{
  "schema_version": "1.0",
  "source": "polymarket_public_gamma",
  "analysis_input_only": true,
  "authentication_used": false,
  "account_connected": false,
  "trading_enabled": false,
  "target": {
    "home": "亚特兰大",
    "away": "博洛尼亚",
    "kickoff": "2026-09-01 02:45"
  },
  "match": {
    "status": "NEEDS_ENGLISH_TEAM_ALIASES"
  },
  "quality_flags": [
    "NEEDS_ENGLISH_TEAM_ALIASES"
  ]
}