{
  "schema_version": "1.0",
  "source": "polymarket_public_gamma",
  "analysis_input_only": true,
  "authentication_used": false,
  "account_connected": false,
  "trading_enabled": false,
  "target": {
    "home": "法国",
    "away": "英格兰",
    "kickoff": "2026-07-19 05:00"
  },
  "match": {
    "status": "NEEDS_ENGLISH_TEAM_ALIASES"
  },
  "quality_flags": [
    "NEEDS_ENGLISH_TEAM_ALIASES"
  ]
}